Official Resources,,Magento Blog,http://magento.com/blog,Get the latest in Magento News,
Official Resources,Magento 1,Magento CE User Guide,http://merch.docs.magento.com/ce/user+AF8-guide/Magento+AF8-Community+AF8-Edition+AF8-User+AF8-Guide.html,+ACI-Where you+//0A4v/9AID//QCZ-ll find the most up+AC0-to+AC0-date documentation for the current release, written with merchants in mind+ACI-,
Official Resources,,Magento Documentation and Resources,https://magento.com/resources/technical,Everything you need to build and manage a customized Magento storefront,
Official Resources,Magento 1,Magento EE User Guide,http://merch.docs.magento.com/ee/user+AF8-guide/Magento+AF8-Enterprise+AF8-Edition+AF8-User+AF8-Guide.html,,
Official Resources,Magento 2,Magento 2 code repository,https://github.com/magento/magento2,Official Magento 2 GitHub repository,
Official Resources,,Magento DevBlog,https://community.magento.com/t5/Magento+AC0-DevBlog/bg+AC0-p/devblog,The official Magento developers blog,
Official Resources,,MagentoU Videos,https://www.youtube.com/playlist?list+AD0-PLZur+AF8-lHjB8biFVdYncLbvFg+AF8-vKPUqio40,MagentoU playlist on YouTube,
Other Resources,Magento 2,Awesome Magento 2,https://github.com/DavidLambauer/awesome+AC0-magento2/,A curated list of awesome Magento 2 Extensions +ACY- Resources by David Lambauer,
Certification,,Magento Certification,http://magento.com/training/catalog/certification,The catalog of all Magento certifications,
Certification,Magento 1,Magento Certification Practice Test,http://magento+AC0-quiz.magestore.com/,Test your skill with Magento Certification Quiz by MageStore,
Certification,Magento 1,MageCert,http://magecert.com/,Revision notes for the Magento Developer Certification exam,
Certification,Magento 1,Magento on Quizlet,https://quizlet.com/87021557/magento+AC0-certified+AC0-solution+AC0-specialist+AC0-flash+AC0-cards/,Magento Certified Solution Specialist study set by Thomas Clunan,
Certification,Magento 1,Magento Certified Front End Developer Exam Study Guide,http://info.demacmedia.com/magento+AC0-certified+AC0-front+AC0-end+AC0-exam+AC0-study+AC0-guide,A free ebook by Demac Media for anyone who is planning on taking the exam and is in the process of preparing for it,
Certification,Magento 2,Magento 2 Certified Solution Specialist Practice Test,https://swiftotter.com/technical/magento+AC0-2+AC0-certified+AC0-solution+AC0-specialist+AC0-practice+AC0-test+ACM-take+AC0-test,Sample practice test for the Magento 2 Certified Solution Specialist exam by SwiftOtter,
Certification,Magento 2,Magento 2 Certified Solution Specialist Exam Study Guide,https://swiftotter.com/technical/magento+AC0-2+AC0-certified+AC0-solution+AC0-specialist+AC0-exam+AC0-study+AC0-guide,A free study guide by SwiftOtter for Magento 2 Certified Solution Specialist exam,
Certification,Magento 2,Magento 2 Certified Professional Developer Study Guide,https://swiftotter.com/technical/magento+AC0-2+AC0-certified+AC0-developer+AC0-study+AC0-guide,A free study guide by SwiftOtter for Magento 2 Certified Professional Developer exam,
Certification,Magento 2,Magento 2 Certified Professional Developer Practice Test,https://swiftotter.com/technical/magento+AC0-2+AC0-certified+AC0-developer+AC0-practice+AC0-test,Sample practice test for the Magento 2 Certified Professional Developer exam by SwiftOtter,
Certification,Magento 2,M2 Certification Study Guides,https://github.com/df2k2/m2cert,Magento2 Study Guides in MD syntax for note+AC0-taking while researching and studying each of the exam topics,
Certification,Magento 2,Magento 2 Certified Professional Developer notes,https://github.com/magento+AC0-notes/magento2+AC0-exam+AC0-notes,Preparation notes for Magento 2 Certified Professional Developer exam,
Books,Magento 1,Getting Started with Magento Extension Development,https://www.packtpub.com/web+AC0-development/getting+AC0-started+AC0-magento+AC0-extension+AC0-development,+ACI-A practical guide to building Magento modules from scratch+ADs- by Branko Ajzele, September 2013+ACI-,
Books,Magento 1,Magento Best Practices Handbook,https://leanpub.com/magebp,+ACI-A collection of practical advices to develop with Magento the right way+ADs- by Alessandro Ronchi, September 2015+ACI-,
Books,Magento 1,Magento PHP Developer's Guide,http://magedevguide.com/,+ACI-A giude that helps new developers to quickly pickup the fundamentals of Magento system+ADs- by Allan MacGregor, April 2013+ACI-,
Books,Magento 1,Magento Product Types: Developer's Guide,https://leanpub.com/magentoproducttypesdevelopersguide,+ACI-A book that gives a deep inside on Magento product types+ADs- by Oleg Ishenko, October 2014+ACI-,
Books,Magento 1,Magento Search Engine Optimization,https://www.packtpub.com/web+AC0-development/magento+AC0-search+AC0-engine+AC0-optimization,+ACI-A book that uncovers the deep secrets of successful Search Engine Optimization+ADs- by Robert Kent, January 2014+ACI-,
Books,Magento 1,Mastering Magento Theme Design,https://www.packtpub.com/web+AC0-development/mastering+AC0-magento+AC0-theme+AC0-design,+ACI-A book that explores Magento theme design in depth+ADs- by Andrea Sacc+//0Aw//9AKA-, April 2014+ACI-,
Books,Magento 1,No Frills Command Line Magento,https://leanpub.com/command+AC0-line+AC0-magento/,+ACI-A crash course in efficient Magento administration, as well as PHP, Symfony, and Composer development+ADs- by Alan Storm, December 2014+ACI-,
Books,Magento 1,No Frills Magento Layout,http://store.pulsestorm.net/products/no+AC0-frills+AC0-magento+AC0-layout,+ACI-The only Magento book out there that covers, in full, the enigmatic XML Layout system+ADs- by Alan Storm, April 2011+ACI-,
Books,Magento 1,The Definitive Guide to Magento,http://www.amazon.co.uk/Definitive+AC0-Guide+AC0-Magento+AC0-Experts+AC0-Source+AC0-x/dp/1430272295/ref+AD0-sr+AF8-1+AF8-1,+ACI-A comprehensive look at Magento system+ADs- by Adam McCombs, December 2009+ACI-,
Books,Magento 1,Magento 1.8 Development Cookbook,https://www.packtpub.com/web+AC0-development/magento+AC0-18+AC0-development+AC0-cookbook,+ACI-A book that helps you build a truly impressive customized online store+ADs- by Bart Delvaux +ACY- Nurul Ferdous, February 2014+ACI-,
Books,Magento 2,Learning Magento 2 Administration,https://www.packtpub.com/web+AC0-development/learning+AC0-magento+AC0-2+AC0-administration,+ACI-A step+AC0-by+AC0-step course in setting up your Magento 2 website+ADs- by Bret Williams +ACY- Cyndi Williams, May 2016+ACI-,
Books,Magento 2,Magento 2 Cookbook,https://www.packtpub.com/web+AC0-development/magento+AC0-2+AC0-cookbook,+ACI-Over 50 practical recipes that will help you realize the full potential of Magento in order to build a professional online store+ADs- by Ray Bogman +ACY- Vladimir Kerkhoff, March 2016+ACI-,
Books,Magento 2,Magento 2 Developer's Guide,https://www.packtpub.com/web+AC0-development/magento+AC0-2+AC0-developers+AC0-guide,+ACI-A step+AC0-by+AC0-step guide on how to extend the core functionality of your Magento 2 store+ADs- by Branko Ajzele, December 2015+ACI-,
Books,Magento 2,Magento 2 Development Cookbook,https://www.packtpub.com/web+AC0-development/magento+AC0-2+AC0-development+AC0-cookbook,+ACI-Over 60 recipes that will tailor and customize your experience with Magento 2+ADs- by Bart Delvaux, December 2015+ACI-,
Books,Magento 2,Magento 2 Development Essentials,https://www.packtpub.com/web+AC0-development/magento+AC0-2+AC0-development+AC0-essentials,+ACI-A fast+AC0-paced tutorial that provides you with skills to successfully create themes, extensions, and solutions to Magento 2 projects+ADs- by Fernando J Miguel, February 2016+ACI-,
Books,Magento 2,Magento 2 DIY. The Complete Guide,https://leanpub.com/magento2diy,+ACI-An overview of the platform and  its current technology stack, API, and features+ADs- by Viktor Khliupko, March 2016+ACI-,
Books,Magento 2,Magento 2 Extensions Development,https://www.packtpub.com/web+AC0-development/magento+AC0-extensions+AC0-development,+ACI-A book about the writing of innovative and complex extensions+ADs- by J+//0Aw//9AKk-r+//0Aw//9AKk-mie Bouchet, June 2016+ACI-,
Books,Magento 2,Magento 2 Primer: Getting Stuff Done with Magento 2,http://www.amazon.com/Magento+AC0-Primer+AC0-Getting+AC0-Stuff+AC0-Done+AC0-ebook/dp/B019PCMJ7A/,+ACI-An introduction to the Magento 2 architecture and terminology+ADs- by Alan Kent, December 2015+ACI-,
Books,Magento 2,Mastering Magento PHP Development,https://www.packtpub.com/web+AC0-development/mastering+AC0-magento+AC0-php+AC0-development,+ACI-A book that teaches you the concepts and immediately shows you how to implement them.+ADs- by Ryan Street, February 2017+ACI-,
Books,Magento 2,Theme Web Page Assets: Getting Stuff Done with Magento 2,http://www.amazon.com/Magento+AC0-Theme+AC0-Assets+AC0-Getting+AC0-Stuff+AC0-ebook/dp/B01COQPQG0/,+ACI-This volume focuses on CSS, HTML, and JavaScript page assets for themes+ADs- by Alan Kent, March 2016+ACI-,
Books,Magento 2,Mastering Magento 2 +AC0- Second Edition,https://www.packtpub.com/web+AC0-development/mastering+AC0-magento+AC0-2+AC0-second+AC0-edition,+ACI-This book offers you advanced guidance on managing a Magento 2 store+ADs- by Bret Williams +ACY- Jonathan Bownds, June 2016+ACI-,
Books,Magento 2,Magento 2 Beginners Guide,https://www.packtpub.com/web+AC0-development/magento+AC0-2+AC0-beginners+AC0-guide,+ACI-An introductory guide on managing a Magento 2 store+ADs- by Gabriel Guarino, March 2017+ACI-,
Books,Magento 2,Magento 2 Theme Design +//0A4v/9AID//QCT- Second Edition,https://www.packtpub.com/web+AC0-development/magento+AC0-2+AC0-theme+AC0-design+AC0-second+AC0-edition,+ACI-A starting guide to create responsive Magento 2 themes+ADs- by Fernando J Miguel +ACY- Richard Carter, October 2016+ACI-,
Books,Magento 2,Magento 2 +AC0- Build World+AC0-Class online stores,https://www.packtpub.com/web+AC0-development/magento+AC0-2+AC0-build+AC0-world+AC0-class+AC0-online+AC0-stores,+ACI-A guide on how to develop rich and compelling Magento 2 solutions, themes, and extensions+ADs- by Fernando J Miguel et al, March 2017+ACI-,
Books,Magento 2,Magento 2 Guida allo sviluppo,https://www.amazon.it/Magento+AC0-2+AC0-Guida+AC0-allo+AC0-sviluppo/dp/8868956551,+ACI-This book focuses on module developing best practices (Italian version only)+ADs- by Michele Fantetti, May 2018+ACI-,
Tools,Free,MageMeter,http://www.magemeter.com/,Magento Benchmarks metered using official Magento Performance Toolkit,
Tools,Free,Magereverse,http://www.magereverse.com/,MAGEREVERSE is an online Database Diagram Tool dedicated to Magento 1 eCommerce CE Edition.,
Tools,Free,Modman (Module Manager),https://github.com/colinmollenhour/modman,Allows you to separate your Magento 1 files from core files and keep different extensions under version control,
Tools,Free,PhpStorm Magento 2 Plugin,https://github.com/dkvashninbay/magento2plugin,A plugin for Magento 2 development in the PhpStorm IDE,
Tools,Free,netz98 magerun CLI tools for Magento 1,https://github.com/netz98/n98+AC0-magerun,Provides some handy tools to work with Magento from command line,
Tools,Free,netz98 magerun CLI tools for Magento 2,https://github.com/netz98/n98+AC0-magerun2,The swiss army knife for Magento 2 developers,
Tools,Free,Mage.coach,https://mage.coach/,Your Magento Performance Coach,
Tools,Commercial with freemium/trial,Commerce Bug,http://store.pulsestorm.net/products/commerce+AC0-bug+AC0-3,Magento debugging extension for both Magento 1 and 2,
Tools,Commercial with freemium/trial,Mage2Gen,https://mage2gen.com/,Magento 2 module creator,
Tools,Commercial with freemium/trial,MageCloud,http://www.magecloud.net/,Allows store owners and developers to deploy Magento instances automatically,
Tools,Commercial with freemium/trial,MageFlow,https://mageflow.com/,+ACI-Magento extension for migrating content between development, staging and production environments+ACI-,
Tools,Commercial with freemium/trial,Magento Speed Test,http://www.magespeedtest.com/,Magento Speed Test with Siege,
Tools,Commercial with freemium/trial,Magicento,http://magicento.com/,PHPStorm plugin for both Magento 1 and Magento 2 developers,
Security,,Magento+//0Awv/9AK4- SUPEE+AC0-6788 Developer Toolbox,https://github.com/rhoerr/supee+AC0-6788+AC0-toolbox,Must+AC0-have tool to apply SUPEE+AC0-6788 patch,
Security,,Philwinkle+AF8-AppliedPatches,https://github.com/philwinkle/Philwinkle+AF8-AppliedPatches,Useful extension to see a list of all applied patches from within the Magento admin panel,
Security,,Magento Security Center,http://magento.com/security/,+ACI-The dedicated resource to stay abreast of the latest security news, best practices, patch releases and bug fixes+ACI-,
Security,,MageReport.com,https://www.magereport.com/,Scan your Magento shop for known security vulnerabilities,
Security,,Magento Extension Security research,https://docs.google.com/forms/d/1gLvwzJlBfqCcr4NbHmm557wNvDpDuKmFlznL2vyt3fI/viewform,Submit your open source Magento 1 extensions for vulnerabilities review by Talesh Seeparsan,
Security,,Magento+AC0-Pre+AC0-Patched+AC0-Files,https://github.com/magecomp/Magento+AC0-Pre+AC0-Patched+AC0-Files,Pre Patched files for installing Magento Security Patches without SSH.,
Security,,Mage Security Patcher,https://github.com/magesec/magesecuritypatcher,An effective alternative to the standard magento patches.,
Extensions,Magento 1,Magneto Debug,https://github.com/madalinoprea/magneto+AC0-debug,Magento 1.x developer debug toolbar,
Extensions,Magento 1,AOE Profiler,https://github.com/AOEpeople/Aoe+AF8-Profiler,A drop+AC0-in replacement for the Varien+AF8-Profiler that captures all data and also records its hierarchal information and displays everything in a nice way,
Extensions,Magento 1,AOE Scheduler for Magento,https://github.com/AOEpeople/Aoe+AF8-Scheduler,+ACI-Sits on top of Magento's default cron functionality allowing you to manage the jobs, to visualize the timeline and to get some deeper insight on what's going on behind the scenes+ACI-,
Extensions,Magento 1,AOE Template Hints,https://github.com/AOEpeople/Aoe+AF8-TemplateHints,+ACI-Extends the default Magento +ACIAIg-Template Hints+ACIAIg- developer functionality by adding more information for each block+ACI-,
Extensions,Magento 1,Aschroder SMTPPro,https://github.com/aschroder/Magento+AC0-SMTP+AC0-Pro+AC0-Email+AC0-Extension,Full SMTP and Gmail/Google Apps Email support for Magento 1,
Extensions,Magento 1,AvS Fast Simple Import,https://github.com/avstudnitz/AvS+AF8-FastSimpleImport,Wrapper for Magento 1 Import/Export functionality which imports data from arrays,
Extensions,Magento 1,b+AC0-responsive,https://github.com/interactiv4/b+AC0-responsive,Magento Responsive Theme built with Twitter Bootstrap v3,
Extensions,Magento 1,Compressed Magento 1.9 Sample Data,https://github.com/Vinai/compressed+AC0-magento+AC0-sample+AC0-data,A reduced sample data archive for Magento 1 by Vinai Kopp,
Extensions,Magento 1,Danslo AoP,https://github.com/danslo/Danslo+AF8-Aop,Enables Aspect+AC0-Oriented Programming in Magento,
Extensions,Magento 1,Danslo ApiImport,https://github.com/danslo/ApiImport,Wrapper for Magento Import/Export,
Extensions,Magento 1,EcomDev Layout Compiler,https://github.com/EcomDev/EcomDev+AF8-LayoutCompiler,Transforms recursive Magento 1 XML ayout files into simple one level php code,
Extensions,Magento 1,Firegento Debug,https://github.com/firegento/firegento+AC0-debug,Provides some debbuging functionality for Magento,
Extensions,Magento 1,Firegento Logger,https://github.com/firegento/firegento+AC0-logger,Provides a simple framework for different logging adapters,
Extensions,Magento 1,Firegento PDF,https://github.com/firegento/firegento+AC0-pdf,+ACI-Overwrites standard PDF layouts for invoices, shipments and creditmemos+ACI-,
Extensions,Magento 1,Flagbit ChangeAttributeSet,https://github.com/Flagbit/Magento+AC0-ChangeAttributeSet,Extension that lets you change attribute set for every product,
Extensions,Magento 1,Magemonolog,https://github.com/aleron75/magemonolog,Provides a custom writer model to transparently use Monolog as logging library,
Extensions,Magento 1,LimeSoda Environment Configuration,https://github.com/LimeSoda/LimeSoda+AF8-EnvironmentConfiguration,,
Extensions,Magento 1,LimeSoda Sample Data Generator,https://github.com/LimeSoda/LimeSoda+AF8-SampleDataGenerator,+ACI-Generate Magento websites, stores, categories, products, customers etc.+ACI-,
Extensions,Magento 1,Magento Composer Installer,https://github.com/Cotya/magento+AC0-composer+AC0-installer,Enable composer to install Magento modules,
Extensions,Magento 1,Magento Project Mess Detector,https://github.com/AOEpeople/mpmd,n98+AC0-magerun addon to find out how messed up a Magento instance is,
Extensions,Magento 1,Magento PSR+AC0-0 Autoloader,https://github.com/magento+AC0-hackathon/Magento+AC0-PSR+AC0-0+AC0-Autoloader,Adds a PSR+AC0-0 Autoloader before the Magento Autoloader,
Extensions,Magento 1,MagentoTarToConnect,https://github.com/astorm/MagentoTarToConnect,Shell script by Alan Storm to package tar archives into Magento's Connect 2.0 format,
Extensions,Magento 1,Mageploy,https://github.com/pug+AC0-more/mageploy,Keep track of changes and deploy synchronization between different Magento environments,
Extensions,Magento 1,Ultimate Module Creator,https://github.com/tzyganu/UMC1.9,Extension that lets you create other Magento 1 CRUD modules for your own entities +ACoAKg-unmaintained+ACoAKg-,
Extensions,Magento 1,No Flash Image Uploader,https://github.com/openstream/No+AC0-Flash+AC0-Image+AC0-Uploader,This Magento module allows the upload of images without having the Flash player installed,
Extensions,Magento 1,N98+AF8-LayoutHelper,https://github.com/netz98/N98+AF8-LayoutHelper,Helpful methods to be called in layout actions to allow more customizations via local.xml without touching the original layout files,
Extensions,Magento 1,MageSpecialist DevTools for Magento 1,https://github.com/magespecialist/m1+AC0-MSP+AF8-DevTools,intended to be used with +AFs-MSP Chrome Toolbar+AF0-(https://github.com/magespecialist/mage+AC0-chrome+AC0-toolbar),
Extensions,Magento 1,Mgt Developer Toolbar for Magento 1,https://www.mgt+AC0-commerce.com/magento+AC0-developer+AC0-toolbar.html,+ACI-Magento 1 developer toolbar with profiling, database queries, handles, event/observer overview, block nesting, requests and caching.+ACI-,
Extensions,Magento 2,Yireo GoogleTagManager2,https://github.com/yireo/Yireo+AF8-GoogleTagManager2,Add Google Tag Manager to Magento2,
Extensions,Magento 2,Danslo CleanCheckout,https://github.com/danslo/CleanCheckout,A drop+AC0-in replacement for the Magento 2 checkout,
Extensions,Magento 2,MageMojo cron project,https://github.com/magemojo/m2+AC0-ce+AC0-cron,+ACI-This module for Magento 2 overrides base magento cron functionality, fixes known bugs, and provides a cron service model to control cron process execution.+ACI-,
Extensions,Magento 2,MSP+AF8-SMTP,https://github.com/magespecialist/m2+AC0-MSP+AF8-SMTP,MSP+AF8-SMTP is a module for Magento 2 allowing send mail via SMTP,
Extensions,Magento 2,ElasticSuite for Magento 2 ,https://github.com/Smile+AC0-SA/elasticsuite,A feature+AC0-rich merchandising suite for Magento 2.,
Extensions,Magento 2,Magento 2 bash completion,https://github.com/yvoronoy/magento2+AC0-bash+AC0-completion,This plugin adds autocompletion for Magento 2 CLI Sub Commands and their Options,
Extensions,Magento 2,Magento 2 Bash Install/Restore Script,https://github.com/yvoronoy/m2install,A script designed to simplify the installation process of Magento 2 and rapid deployment of merchant code and DB dumps.,
Extensions,Magento 2,Magento 2 Cron Job Manager,https://github.com/Ethan3600/magento2+AC0-CronjobManager,A Cron Job Manager Module by Ethan Yehuda,
Extensions,Magento 2,MageSpecialist CodeMonkey,https://github.com/magespecialist/m2+AC0-MSP+AF8-CodeMonkey,Magento 2 code generator,
Extensions,Magento 2,MageSpecialist DevTools for Magento 2,https://github.com/magespecialist/m2+AC0-MSP+AF8-DevTools,intended to be used with +AFs-MSP Chrome Toolbar+AF0-(https://github.com/magespecialist/mage+AC0-chrome+AC0-toolbar),
Extensions,Magento 2,Mgt Developer Toolbar for Magento 2,https://github.com/mgtcommerce/Mgt+AF8-Developertoolbar,A dev toolbar that shows all important information for performance optimisation and Magento development.,
Extensions,Magento 2,Magento 2 Deployer Plus,https://github.com/jalogut/magento2+AC0-deployer+AC0-plus,Tool based on deployer.org to perform zero downtime deployments of Magento 2 projects,
Testing frameworks,,Digital Pianism Test Framework,https://github.com/digitalpianism/testframework,A simple framework to be used to create unit and integration tests on Magento 1,
Testing frameworks,,EcomDev PHPUnit,https://github.com/EcomDev/EcomDev+AF8-PHPUnit,Magento PHPUnit Integration +ACoAKg-unmaintained+ACoAKg-,
Testing frameworks,,Magium,https://github.com/magium/Magium,A PHPUnit/Webdriver (Selenium) based test framework,
Testing frameworks,,xtest,http://xtest+AC0-mage.com/,Simple Magento Testing Framework,
Blogs,,Alessandro Ronchi,http://aleron75.com,,
Blogs,,Magenable,https://magenable.com.au/category/magento+AC0-ecommerce/,,
Blogs,,Magento Fox Blog,https://adammoss.co.uk/magentofox/,,
Blogs,,Aheadworks Blog,https://blog.aheadworks.com/category/magento+AC0-2/,,
Blogs,,AionHill blog,https://aionhill.com/category/magento+AC0-development+AC0-tips,,
Blogs,,Alan Kent,https://alankent.wordpress.com,,
Blogs,,Alan Storm,http://alanstorm.com/category/magento,,
Blogs,,Amasty Blog,https://blog.amasty.com/category/magento+AC0-2/,,
Blogs,,Andrew Smart,https://www.smartiehastheanswer.co.uk/,,
Blogs,,Anna V+//0Aw//9ALY-lkl,http://anna.voelkl.at/,,
Blogs,,Ash Smith,https://www.ashsmith.io/blog/,,
Blogs,,Ashley Schroder,http://www.aschroder.com/category/magento/,,
Blogs,,Atwix blog,http://www.atwix.com/blog/,,
Blogs,,Belvg,http://blog.belvg.com/category/magento+AC0-news,,
Blogs,,Ben Marks,http://bhmarks.com/blog/,,
Blogs,,bitExpert AG,https://blog.bitexpert.de/blog/tag/magento,,
Blogs,,Bitbull,https://www.bitbull.it/en/blog/,,
Blogs,,Brideo,http://brideo.co.uk/blog/,,
Blogs,,C3Media Blog,https://www.c3media.co.uk/blog/,,
Blogs,,Classyllama,http://www.classyllama.com/blog/category/magento,,
Blogs,,Cloudways Blog,https://www.cloudways.com/blog/category/magento/,,
Blogs,,Cool Ryan,http://www.coolryan.com/category/magento/,,
Blogs,,Creare Blog,http://www.creare.co.uk/blog/magento,,
Blogs,,Cyrill Schumacher,http://cyrillschumacher.com/,,
Blogs,,David Alger,http://davidalger.com/category/development/magento/,,
Blogs,,Darko Poposki,http://darkopoposki.com/articles,,
Blogs,,DCKAP Blog,http://www.dckap.com/blog,,
Blogs,,Demac Media,http://www.demacmedia.com/category/magento+AC0-commerce/,,
Blogs,,Digital Pianism,http://www.digital+AC0-pianism.com/en/blog/,,
Blogs,,ESchrade,http://www.eschrade.com/page/category/magento+AC0-2/,,
Blogs,,Excellence Technologies,http://excellencemagentoblog.com/,,
Blogs,,Fabian Schmengler,http://www.schmengler+AC0-se.de/en/blog/,,
Blogs,,Fabrizio Branca,http://fbrnc.net/,,
Blogs,,Firebear Studio Blog,http://firebearstudio.com/blog/,,
Blogs,,Fooman,http://store.fooman.co.nz/blog,,
Blogs,,Ibnab Blog,http://ibnab.com/en/blog/magento+AC0-2,,
Blogs,,Inchoo,http://inchoo.net/category/magento/,,
Blogs,,integer+AF8-net Blog,http://www.integer+AC0-net.com/blog/,,
Blogs,,InteractOne Blog,http://www.interactone.com/category/magento+AC0-news/,,
Blogs,,James Cowie,http://jamescowie.me/,,
Blogs,,Kalpesh Mehta,http://ka.lpe.sh/,,
Blogs,,LexiConn,http://www.lexiconn.com/blog/category/magento/,,
Blogs,,Magebase,http://magebase.com/,,
Blogs,,MageComp Magento Blog,http://magecomp.com/blog/,,
Blogs,,Mage Inferno,http://mageinferno.com/blog,,
Blogs,,Mage News,http://www.mage+AC0-news.de/,,
Blogs,,Magenticians,http://magenticians.com/,,
Blogs,,Magently Blog,https://magently.com/blog/,,
Blogs,,Magento Blog,http://magento.com/blog,,
Blogs,,MagePsycho,http://www.blog.magepsycho.com/,,
Blogs,,Magestore,http://blog.magestore.com/,,
Blogs,,Magetraining Blog,http://www.magetraining.com/blog/,,
Blogs,,MageWorx on Magento 1,http://blog.mageworx.com/magento/,,
Blogs,,MageWorx on Magento 2,http://blog.mageworx.com/magento/,,
Blogs,,Mark Shust,http://markshust.com/tags/magento,,
Blogs,,Max Pronko,http://www.maxpronko.com/,,
Blogs,,Max Yekaterynenko,https://maxyek.wordpress.com/,,
Blogs,,Maxime Huran on Magento 1,http://www.maximehuran.fr/en/category/magento+AC0-one/,,
Blogs,,Maxime Huran on Magento 2,http://www.maximehuran.fr/en/category/magento+AC0-two/,,
Blogs,,Meanbee,https://meanbee.com/developers.html,,
Blogs,,Newsgento,http://newsgento.com/,,
Blogs,,Nexcess Blog,https://blog.nexcess.net/category/magento+AC0-2/,,
Blogs,,Nick Jones,https://www.nicksays.co.uk/magento/,,
Blogs,,Phillip Jackson,http://blog.philseattlekle.com/,,
Blogs,,Phuc Vo,http://www.thienphucvx.com/,,
Blogs,,Rebecca Brocton,http://rebeccabrocton.com/category/posts/magento/,,
Blogs,,Session Digital on Magento,http://www.sessiondigital.com/blog/category/magento/,,
Blogs,,Session Digital DE on Magento,http://www.sessiondigital.de/blog/category/magento/,,
Blogs,,Session Digital on Magento 2,http://www.sessiondigital.com/blog/category/magento+AC0-2/,,
Blogs,,Shero Blog,https://www.sherodesigns.com/blog/,,
Blogs,,Siteground,https://www.siteground.com/tutorials/magento/,,
Blogs,,Solving Magento,http://www.solvingmagento.com/,,
Blogs,,Space48 Blog,http://www.space48.com/category/magento/,,
Blogs,,Sonassi,https://www.sonassi.com/blog/,,
Blogs,,Swapnil Bhavsar,https://swapnil.co/blog/category/magento,,
Blogs,,Talesh Seeparsan,http://www.seeparsan.net/magento+AC0-blog/,,
Blogs,,Yireo Blog,https://www.yireo.com/blog,,
Blogs,,Dev98,https://dev98.de/,,
Blogs,,Marcel Hauri,https://blog.hauri.me/,,
Blogs,,Pierre Fay,https://www.pierrefay.com/en/tag/magento2.html,,
Blogs,,Revampix,https://www.revampix.com/,,
Blogs,,Sergii Ivashchenko,http://www.sivaschenko.com/,,
Blogs,,MGT+AC0-Commerce Blog,https://www.mgt+AC0-commerce.com/blog/category/magento/,,
